amie,nombre_institucion
01B00030,UNIDAD EDUCATIVA PARTICULAR BUENA ESPERANZA
01H00001,ESCUELA DE EDUCACION BASICA PARTICULAR CRISTO REY
01H00003,ESCUELA DE EDUCACION BASICA RAFAEL AGUILAR PESANTEZ
01H00010,BENJAMIN RAMIREZ ARTEAGA
01H00048,ESCUELA DE EDUCACION BASICA FISCOMISIONAL PADRE CARLOS CRESPI
01H00082,DOCE DE ABRIL
01H00113,UNIDAD EDUCATIVA SALESIANA MARIA AUXILIADORA
01H00117,UNIDAD EDUCATIVA PARTICULAR CORAZON DE MARIA
01H00120,UNIDAD EDUCATIVA PARTICULAR MISIONEROS OBLATOS
01H00172,SANTA MARIANA DE JESUS
01H00174,ESCUELA DE EDUCACION BASICA FISCOMISIONAL DANIEL HERMIDA
01H00188,ESCUELA DE EDUCACION BASICA PARTICULAR ARZOBISPO SERRANO
01H00199,UNIDAD EDUCATIVA PARTICULAR HERMANO MIGUEL DE LA SALLE
01H00209,UNIDAD EDUCATIVA FE Y ALEGRIA
01H00213,UNIDAD EDUCATIVA PARTICULAR LA ASUNCION
01H00241,UNIDAD EDUCATIVA PARTICULAR KENNEDY
01H00271,SUDAMERICANO
01H00281,MANUELA CAÑIZARES
01H00300,UNIDAD EDUCATIVA PARTICULAR SANTANA UNESA
01H00324,UNIDAD EDUCATIVA PARTICULAR LAS PENCAS
01H00336,COLEGIO DE BACHILLERATO CIUDAD DE CUENCA
01H00339,BELL ACADEMY
01H00358,LUISA DE JESUS CORDERO
01H00374,UNIDAD EDUCATIVA PARTICULAR BILINGÜE NUESTRA FAMILIA
01H00377,UNIDAD EDUCATIVA BILINGÜE INTERAMERICANA
01H00428,ESCUELA DE EDUCACION BASICA PARTICULAR LICEO DECROLIANO INTERNACIONAL
01H00429,MIGUEL MORENO ORDOÑEZ
01H00437,UNIDAD EDUCATIVA PARTICULAR LICEO AMERICANO CATOLICO
01H00448,UNIDAD EDUCATIVA PARTICULAR JUAN PABLO II
01H00475,UNIDAD EDUCATIVA TECNICO SALESIANO
01H00503,SEGUNDO ESPINOSA CALLE
01H00515,UNIDAD EDUCATIVA PARTICULAR BORJA
01H00578,UNIDAD EDUCATIVA CHECA
01H00580,RAFAEL CORRAL MOSCOSO
01H00617,JUAN LEON MERA
01H00655,UNIDAD EDUCATIVA ABDON CALDERON
01H00701,UNIDAD EDUCATIVA PARTICULAR ALEMAN STIEHLE DE CUENCA
01H00706,FRANCISCO EUGENIO TAMARIZ
01H00754,ISAAC A CHICO
01H00759,UNIDAD EDUCATIVA COLEGIO MILITAR ABDON CALDERON
01H00761,ESTADOS UNIDOS DE NORTE AMERICA
01H00762,COLEGIO NACIONAL MIXTO TECNICO INDUSTRIAL RICAURTE
01H00770,MANUEL MARIA PALACIOS BRAVO
01H00771,UNIDAD EDUCATIVA PARTICULAR SANTIAGO DE COMPOSTELA
01H00777,VICENTE LEON PICON
01H00779,FEDERICO MALO
01H00821,JOAQUIN MALO TAMARIZ
01H00855,HONORIO VEGA LARREA
01H00868,FAUSTO MOLINA
01H00887,UNIDAD EDUCATIVA TURI
01H00892,NCOLAS SOJOS JARAMILLO
01H00894,TECNICO GUILLERMO MENSI
01H00977,UNIDAD EDUCATIVA TEMPORAL ALFONSO LITUMA CORREA
01H00982,ESCUELA DE EDUCACION BASICA PARTICULAR HUERTO DEL EDEN
01H01026,MARIANO CUEVA
01H01175,ESCUELA DE EDUCACION BASICA MANUEL J CALLE
01H01176,AGRONOMICO SALESIANO
01H01183,UNIDAD EDUCATIVA ATENAS DEL ECUADOR
01H01202,ESCUELA DE EDUCACION BASICA ANTONIO MORALES
01H01286,ESCUELA DE EDUCACION BASICA FISCOMISIONAL LA INMACULADA
01H01312,UNIDAD EDUCATIVA JAIME ROLDOS AGUILERA
01H01373,ESCUELA DE EDUCACION BASICA ERNESTO LOPEZ
01H01650,ALICIA LOZA MENESES
01H01807,PASOS
01H01825,ESCUELA DE EDUCACION BASICA RICARDO MUÑOZ CHAVEZ
01H02001,UNIDAD EDUCATIVA DEL MILENIO MANUEL J. CALLE
01H02006,UNIDAD EDUCATIVA DEL MILENIO SAYAUSI
01H02008,UNIDAD EDUCATIVA DEL MILENIO QUINGEO
02H00004,EEB ANGEL POLIBIO CHAVES
02H00030,UNIDAD EDUCATIVA VERBO DIVINO
02H00033,UNIDAD EDUCATIVA SANTA MARIANA DE JESUS
02H00185,UNIDAD EDUCATIVA FELIX GRANJA GAMAZO
02H00344,UNIDAD EDUCATIVA SANTA MARIANA DE JESUS MARTINEZ BARBA
02H00557,UE CAMINO REAL
02H00588,UNIDAD EDUCATIVA SAN PABLO DE ATENAS
02H00658,UNIDAD EDUCATIVA MUNICIPAL SEGUNDO ULPIANO FIGUEROA
02H00735,UNIDAD EDUCATIVA TEMPORAL LAS NAVES
03H00023,UNIDAD EDUCATIVA FISCOMISIONAL EMILIA MERCHAN
03H00061,EMILIO ABAD
03H00075,UNIDAD EDUCATIVA PARTICULAR LA PROVIDENCIA
03H00241,JOSE BENIGNO IGLESIAS1
03H00288,UNIDAD EDUCATIVA SAN JOSE DE CALASANZ
03H00424,UNIDAD EDUCATIVA HUAYRAPUNGO
03H00428,HUAYNA CAPAC
03H00502,ESC. DE EDUC. BASIC. PRESIDENTE VELASCO
03H00513,UNIDAD EDUCATIVA PARTICULAR SAN GABRIEL
03H00515,UNIDAD EDUCATIVA PARTICULAR JULIO MARIA MATOVELLE
03H00530,MANUEL DE J CALLE
03H00554,AMAZONAS
03H00577,ESCUELA DE EDUCACION BASICA PARTICULAR MARIANA DE JESUS
03H00612,UNIDAD EDUCATIVA SAN SEBASTIAN
03H00795,UNIDAD EDUCATIVA DEL MILENIO GRAL. ELOY ALFARO DELGADO
04H00001,PRIMERO DE MAYO
04H00026,VICENTE FIERRO
04H00034,HERMANO MIGUEL LA SALLE
04H00070,CESAR ANTONIO MOSQUERA
04H00072,LUIS ALFONSO CALVACHI
04H00079,13 DE DICIEMBRE
04H00091,MARIA AUXILIADORA
04H00095,MALDONADO
04H00140,UNIDAD EDUCATIVA DEL MILENIO CARLOS ROMO DAVILA
04H00263,LEON RUALES
04H00308,EUGENIO ESPEJO
04H00334,PABLO MUÑOZ VEGA
05H00093,VICTORIA VASCONEZ CUVI
05H00094,UNIDAD EDUCATIVA HERMANO MIGUEL
05H00095,FAE N5
05H00097,LA INMACULADA
05H00110,PRIMERO DE ABRIL
05H00124,MANUEL GONZALO ALBAN RUMAZO
05H00145,HERMANOS PAZMIÑO
05H00158,MULALO
05H00186,PASTOCALLE
05H00208,SARA MARIA BUSTILLOS DE ATIAGA
05H00210,JUAN MANUEL LASSO
05H00240,FEDERACION DEPORTIVA DE COTOPAXI
05H00245,UNIDAD EDUCATIVA LA MANA
05H00318,UNIDAD EDUCATIVA GUASAGANDA
05H00322,UNIDAD EDUCATIVA PUCAYACU
05H00350,UNIDAD EDUCATIVA PANGUA
05H00384,GABRIELA MISTRAL
05H00472,TECNICO PUJILI
05H00543,DR.EDMUNDO CARBO
05H00550,UNIDAD EDUCATIVA 14 DE OCTUBRE VICENTE ROCAFUERTE
05H00568,JUAN TULCANAZ ARROYO
05H00595,ALICIA MARCUARD DE YEROVI
05H00617,UNIDAD EDUCATIVA 19 DE SEPTIEMBRE DR CAMILO GALLEGOS D
05H00648,JOSE PERALTA
05H00658,GENERAL RIVADENEIRA GENERAL TERAN
05H00698,GONZALO ESCUDERO
05H00801,UNIDAD EDUCATIVA SAN FRANCISCO DE LAS PAMPAS
06H00010,DR. LEONIDAS GARCIA ORTIZ
06H00013,CENT DE EDUC GEN BASICA GRAL JUAN LAVALLE
06H00032,CAP EDMUNDO CHIRIBOGA
06H00033,UNIDAD EDUCATIVA PENSIONADO OLIVO
06H00040,CAPULLITOS (JARDIN Y ESCUELA)
06H00096,UNIDAD EDUCATIVA CARLOS CISNEROS
06H00112,UNIDAD EDUCATIVA FISCOMISIONAL SANTA MARIANA DE JESUS
06H00123,NAZARENO
06H00129,UNIDAD EDUCATIVA SAN FELIPE NERI
06H00130,COLEGIO LEONARDO DA VINCI
06H00159,PEDRO VICENTE MALDONADO
06H00162,LA SALLE
06H00163,ESCUELA PARTICULAR INTERNACIONAL SAN IGNACIO DE LOYOLA
06H00166,UNIDAD EDUCATIVA MIGUEL ANGEL LEON PONTON
06H00168,ESCUELA DE EDUCACION BASICA EL DESPERTAR
06H00174,ESCUELA DE EDUCACION BASICA FISCAL DR GERMAN ABDO TOUMA
06H00215,UNIDAD EDUCATIVA UNIVERSITARIA MILTON REYES
06H00216,UNIDAD EDUCATIVA SAN VICENTE DE PAUL
06H00220,UNIDAD EDUCATIVA FISCOMISIONAL MARIA AUXILIADORA
06H00222,LEONTIEV VIGOTSKY
06H00223,FE Y ALEGRIA
06H00228,PRINCETON GARDEN SCHOOL
06H00232,UNIDAD EDUCATIVA ISABEL DE GODIN
06H00237,SALESIANO SANTO TOMAS APOSTOL
06H00358,COLEGIO DE BACHILLERATO TECNICO FISCAL LICTO
06H00471,ESCUELA FISCAL MIXTA BERNARDO CASTILLO
06H00527,UNIDAD EDUCATIVA SAN FRANCISCO DE SALES
06H00871,UNIDAD EDUCATIVA MARIA AUXILIADORA FE Y ALEGRIA
06H01044,GARCIA MORENO
06H01046,UNIDAD EDUCATIVA DEL MILENIO GUANO
06H01172,TENIENTE HUGO ORTIZ GARCES
06H01312,CELSO AUGUSTO RODRIGUEZ
07H00029,ENRIQUETA  DE WIND DE LANIADO
07H00036,UNIDAD EDUCATIVA PARTICULAR HERMANO MIGUEL
07H00058,UNIDAD EDUCATIVA MILITAR PARTICULAR 16 DE JUNIO
07H00077,UNIDAD EDUCATIVA PARTICULAR JUANA DE DIOS
07H00124,MANUEL I. ENCALADA MORA
07H00125,CARLOTA RODAS CUERVO DE DAVALOS
07H00206,PROF. ROMULO VIDAL ZEA
07H00223,23 DE ABRIL
07H00229,HEROES DEL 41
07H00289,COLEGIO DE BACHILLERATO HEROES DE JAMBELI
07H00334,DR. MANUEL BENJAMIN CARRION
07H00506,COLEGIO DE BACHILLERATO GRAL. VICENTE ANDA AGUIRRE
07H00630,DR. LUIS FELIPE BORJA
07H00635,PROVINCIA DE LOS RIOS
07H00672,PROF. TULA PEREZ DE VALENCIA
07H00689,UNIDAD EDUCATIVA PARTICULAR JUAN XXIII
07H00697,MUNICIPAL MONSEÑOR LEONIDAS PROAÑO VILLALBA
07H00710,ESCUELA DE EDUCACION BASICA CAP. CESAR EDMUNDO CHIRIBOGA GONZALEZ
07H00755,ESCUELA DE EDUCACION BASICA FEBRES CORDERO
07H00757,LUIS ENRIQUE CORDOVA
07H00773,ZULIMA VACA RIVERA
07H00801,UNIDAD EDUCATIVA PARTICULAR JUAN PABLO II
07H00870,ESCUELA AURELIO PRIETO
07H00879,DR. LEONIDAS GARCIA ORTIZ
07H00880,COLEGIO DE BACHILLERATO OLIVA CARDENAS DE SANCHEZ
07H00959,ESCUELA DE EDUCACION BASICA ANGEL SALVADOR OCHOA
07H01079,COLEGIO DE BACHILLERATO JAMBELI
07H01096,ESC. DE EDUC. BAS. CNEL. FELIX VEGA DAVILA
07H01106,DEMETRIO AGUILERA MALTA
07H01147,CARLOS ZAMBRANO OREJUELA
07H01154,COLEGIO DE BACHILLERATO LIC. FAUSTO MOLINA
07H01247,COLEGIO DE BACHILLERATO HUERTAS
08H00017,ESCUELA DE EDUCACION BASICA FISCOMISIONAL CRISTO REY
08H00023,ESCUELA EGB. REPUBLICA DEL ECUADOR
08H00030,UNIDAD EDUCATIVA FISCOMISIONAL SAN JOSE BENITO COTTOLENGO
08H00043,UNIDAD EDUCATIVA FISCAL ESMERALDAS LIBRES
08H00070,ESC. EGB. FISCOMISIONAL SAN JOSE OBRERO
08H00098,EGB LA PROVIDENCIA
08H00102,UNIDAD EDUCATIVA PARTICULAR LA INMACULADA
08H00107,ESCUELA EGB FISCOMISIONAL MADRE DEL SALVADOR
08H00141,ESCUELA DE EDUCACION GENERAL BASICA JOSE MARIA VELASCO IBARRA
08H00145,COLEGIO DE BACHILLERATO FISCOMISIONAL SAGRADO CORAZON
08H00148,UNIDAD EDUCATIVA FISCOMISIONAL DON BOSCO
08H00194,ESCUELA EGB FISCOMISIONAL NUEVO ECUADOR
08H00241,UNIDAD EDUCATIVA FISCAL BARTOLOMEZ RUIZ
08H00276,JUAN MONTALVO
08H00300,COLEGIO DE BACHILLERATO FISCAL SAN MATEO
08H00302,ESCUELA EGB FISCAL CESAR NEVIL ESTUPIÑAN BASS
08H00325,UNIDAD EDUCATIVA FISCAL TABIAZO
08H00334,UNIDAD EDUCATIVA FISCOMISIONAL SAN FRANCISCO DE ASIS
08H00339,ESCUELA EGB  PEDRO CORNELIO DROUET
08H00347,ESCUELA EGB FISCOMISIONAL BUEN PASTOR
08H00363,UNIDAD EDUCATIVA FISCOMISIONAL SAN DANIEL COMBONI
08H00366,UNIDAD EDUCATIVA FISCOMISIONAL MARIA AUXILIADORA
08H00375,UNIDAD EDUCATIVA FISCOMISIONAL ANGEL BARBISOTTI
08H00391,ESCUELA EGB 15 DE MARZO
08H00411,ESCUELA EGB FISCOMISIONAL DANIEL COMBONI
08H00461,UNIDAD EDUCATIVA BORBON
08H00464,ESCUELA EGB FISCAL MEXICO
08H00479,ESC. EGB FISCOMISIONAL PADRE AURERIO ELIAS MERA
08H00486,UNIDAD EDUC. FISCOMISIONAL CONCEPCION TEMBOURY
08H00496,COLEGIO DE BACHILLERATO FISCAL MALDONADO
08H00562,ESCUELA EGB FISCAL RAFAEL ASTUDILLO
08H00584,UNIDAD EDUCATIVA FISCOMISIONAL SAN LUIS GONZAGA
08H00612,ESC.EGB.MANABI
08H00620,UNIDAD.EDUC-SAN FRANCISCO DEL CABO
08H00646,ESC.EGB.PRESIDENTE ROOSEVELT
08H00663,ESC.EGB.GABRIEL IRIARTE RIOS
08H00672,ESC.EGB MONS.ENRIQUE BARTOLUCCI
08H00737,ESCUELA DE EGB TARQUI N° 92
08H00815,UNIDAD EDUCATIVA CIUDAD DE GUARANDA
08H00826,UNIDAD EDUCATIVA FISCOMISIONAL JUAN XXIII
08H00850,ESC. EGB GASPAR DE VILLARROEL
08H00866,UNIDAD EDUCATIVA FISCOMISIONAL CRISTO REDENTOR
08H00900,UNIDAD EDUCATIVA 10 DE OCTUBRE
08H00920,EGB 24 DE SEPTIEMBRE
08H00957,COLEGIO DE BACHILLERATO FISCAL ESMERALDAS
08H01059,COLEGIO DE BACHILLERATO FISCAL QUITO
08H01087,UNIDAD EDUCATIVA FISCAL LA UNION
08H01089,UNIDAD EDUCATIVA FISCOMISIONAL SANTA MARIA DE NAZARET
08H01123,ESCUELA NUEVO AZUAY
08H01131,PROVINCIA DE ESMERALDAS
08H01181,EVANGELICA LUZ Y LIBERTAD
08H01199,UNIDAD EDUCATIVA FISCOMISIONAL 10 DE AGOSTO
08H01207,ESCUELA EGB FISCAL LIZARDO GOYES BENITEZ
08H01228,ESCUELA EGB 4 DE OCTUBRE
08H01246,ESCUELA EGB FISCAL JOSE GABRIEL BATALLAS
08H01278,UNIDAD EDUC. ESTRELLA DEL MAR
08H01282,UNIDAD EDC.JUAN DE DIOS MORALES
08H01300,ESC.EGB.TONCHIGUE
08H01302,ESCUELA EDUCACION BASICA QUITO
08H01303,ESCUELA EGB FISCOMISIONAL VIKTOR SABIN
08H01329,ESC.EGB.JAIME ROLDOS AGUILERA
08H01341,ESC. EGB. ZOILA UGARTE DE LANDIVAR
08H01343,ESC.EGB.ALEXANDER FLEMING
08H01384,UNIDAD EDUCATIVA ARMENGOL LARA VALENCIA
08H01408,SEBASTIAN DE ILLESCAS
08H01410,PROF. AURELIA BECERRA DE QUIÑONEZ
08H01428,RAMON ESTUPINAN
08H01432,ROCAFUERTE
08H01507,UNIDAD EDUCATIVA FISCOMISIONAL SAN LORENZO
08H02400,UE 22 DE MARZO 
09H00011,ES PART MIXTA 103 MERCEDES MORENO IRIGOYEN
09H00049,UE SAN JOSE DE LA BENEFICENCIA DE SEÑORAS
09H00072,UNIDAD EDUCATIVA SAN JOSE LA SALLE
09H00081,DORA RAMIREZ MARQUEZ 1152
09H00124,UNIDAD EDUCATIVA CIENCIA Y FE
09H00205,SAN JOAQUIN Y SANTA ANA
09H00308,SEÑOR DEL ESPIRITU SANTO
09H00310,JOSE DE LA CUADRA
09H00333,FE Y ALEGRIA
09H00338,DRA. MATILDE HIDALGO DE PROCEL
09H00343,RAFAEL MORAN VALVERDE
09H00374,NUESTRA SEÑORA DEL CISNE
09H00375,CORAZON DE MARIA
09H00378,TEPEYAC
09H00398,JORGE ICAZA CORONEL
09H00402,KENYA Nº 740
09H00436,UNIDAD EDUCATIVA FISCOMISIONAL SANTA MARIA MAZZARELLO
09H00486,UNIDAD EDUCATIVA SALESIANA FISCOMISIONAL DOMINGO SAVIO
09H00558,ESCUELA PARTICULAR LA PRESENTACION
09H00570,UNIDAD EDUCATIVA FISCAL PROF. EDUARDO FLORES TORRES
09H00642,UNIDAD EDUCATIVA ACADEMIA NAVAL ALTAMAR
09H00672,UNIDAD EDUCATIVA DE LA PROVIDENCIA
09H00684,ESCUELA DE EDUCACION BASICA PATRIA ECUATORIANA
09H00721,UNIDAD EDUCATIVA ROSARIO SANCHEZ BRUNO
09H00759,ESCUELA ALEMARY SCHOOL
09H00775,UNIDAD EDUCATIVA JOSE DOMINGO DE SANTISTEVAN
09H00787,UNIDAD EDUCATIVA PARTICULAR CENTRO EDUCATIVO NOVUS
09H00801,UNIDA EDUCATIVA PARTICULAR BATALLA DE JAMBELI
09H00842,UNIDAD EDUCATIVA LICEO NAVAL
09H00843,UNIDAD EDUCATIVA UNIVERSITARIA FRANCISCO HUERTA RENDON
09H00859,ESCUELA DE EDUCACION BASICA PARTICULAR BENEMERITA SOCIEDAD FILANTROPICA DEL GUAYAS
09H00868,UNIDAD EDUCATIVA FISCOMISIONAL HNO. FRANCISCO GARATE
09H00878,ALMIRANTE ILLINGWORTH
09H00911,CRUZ DEL SUR
09H00951,ESCUELA PARTICULAR ESPERANZAS DEL FUTURO
09H00973,UNIDAD EDUCATIVA LICEO CRISTIANO DE GUAYAQUIL
09H00975,ALEMAN HUMBOLDT
09H00992,UNIDAD EDUCATIVA EL ATENEO
09H00995,ESCUELA DE EDUCACION BASICA PARTICULAR REY JESUS
09H01011,UNIDAD EDUCATIVA BILINGÜE LICEO ALBONOR
09H01016,UNIDAD GENERAL BASICA MAKARENKO
09H01096,COLEGIO PARTICULAR MIXTO MUNDO AMERICA
09H01098,UNIDAD EDUCATIVA FISCAL 26 DE NOVIEMBRE
09H01161,UNIDAD EDUCATIVA SANTA ANA
09H01175,UNIDAD EDUCATIVA LOS DELFINES
09H01177,UNIDAD EDUCATIVA PRAGA
09H01212,UNIDAD EDUCATIVA BASICA PARTICULAR NUESTRA SEÑORA DEL CARMEN
09H01215,UNIDAD EDUCATIVA PARTICULAR UNIVERSIDAD CATOLICA
09H01221,CENTRO DE  EDUCACION BASICA VESPERTINO SAN JOSEMARIA ESCRIVA
09H01224,UNIDAD EDUCATIVA PARTICULAR INDEPENDENCIA ECUATORIANA
09H01225,UNIDAD EDUCATIVA CLAIRE BUCARAM DE AIVAS
09H01229,ESCUELA DE EDUCACION BASICA COMPLETA FISCAL FRANCISCO GARCIA AVILES
09H01239,UNIDAD EDUCATIVA CENEST HARVARD
09H01309,JARDIN ESCUELA MANUEL MESTANZA ONOFRE
09H01324,ESCUELA FISCAL DR. JOSE MIGUEL GARCIA MORENO
09H01346,TENIENTE HUGO ORTIZ GARCES
09H01359,UNIDAD EDUCATIVA POLITECNICO
09H01372,COLEGIO PROVINCIA DE BOLIVAR
09H01375,UNIDAD EDUCATIVA PARTICULAR JAVIER
09H01418,UNIDAD EDUCATIVA BASICA OLIMPIA
09H01420,UNIDAD EDUCATIVA FISCOMISIONAL SAN BENILDO LA SALLE
09H01463,UNIDAD EDUCATIVA PARTICULAR JEAN PIAGET
09H01474,GENERACION 2000
09H01518,EL PARAISO DE LA FUENTE DEL SABER
09H01527,ESCUELA DE EDUCACION BASICA PARTICULAR DR. AGUSTIN CUEVA TAMARIZ
09H01574,ESCUELA DE EDUCACION BASICA ELIAS MUÑOZ VICUÑA
09H01710,ESCUELA FISCAL MIXTA EMILIO CLEMENTE HUERTA
09H01717,ESCUELA DE EDUCACION BASICA COMPLETA FISCAL ELIAS RIVERO GONGORA
09H01749,ESCUELA PARTICULAR DIECINUEVE DE ENERO
09H01775,ESCUELA DE EDUCACION BASICA FISCAL GUADALUPE LARRIVA GONZALEZ
09H01781,CEFERINO NAMUNCURA
09H01785,UNIDAD EDUCATIVA JOHANN HERBART
09H01800,ESCUELA DE EDUCACION BASICA PARTICULAR FERNANDO PIZARRO BERMEO
09H01803,ESCUELA DE EDUCACION BASICA FISCAL ADALBERTO ORTIZ QUIÑONEZ
09H01822,ESCUELA DE EDUCACION BASICA PARTICULAR PADRE CARLOS CARDENAS VILLAFUERTE
09H01844,UNIDAD EDUCATIVA NUEVO PACTO
09H01860,UNIDAD EDUCATIVA BILINGÜE ESPIRITU SANTO
09H01882,UNIDAD EDUCATIVA FISCAL FUERTE MILITAR HUANCAVILCA
09H01942,ESCUELA DE EDUCACION BASICA FISCAL REPUBLICA DE COLOMBIA
09H01975,UNIDAD EDUCATIVA JOSE MARIA EGAS
09H01981,UNIDAD EDUCATIVA SALESIANA CRISTOBAL COLON
09H02006,UNIDAD EDUCATIVA BILINGUE DE LA INMACULADA
09H02009,UNIDAD EDUCATIVA SALESIANA FISCOMISIONAL DOMINGO COMIN
09H02019,ESCUELA PARTICULAR LICEO PANAMERICANO CENTENARIO
09H02032,UNIDAD EDUCATIVA FISCAL JOSE ALFREDO LLERENA
09H02049,UNIDAD EDUCATIVA FISCAL NUEVE DE OCTUBRE
09H02072,ESCUELA DE EDUCACION BASICA PARTICULAR  PADRE JUAN DE VELASCO
09H02089,MONSEÑOR JUAN MARIA RIERA
09H02095,NELA MARTINEZ ESPINOZA
09H02146,UNIDAD EDUCATIVA PARTICULAR SERGIO NUÑEZ SANTAMARIA
09H02166,ESCUELA DE EDUCACION BASICA FISCAL JORGE VILLEGAS SERRANO
09H02195,LUIS ALBERTO COSTALES CAZAR
09H02214,PARTICULAR EUROAMERICA
09H02230,ESCUELA DE EDUACION BASICA PARTICULAR O.E.I.
09H02249,AMERICAN SCHOOL
09H02336,ESCUELA DE EDUCACION BASICA FISCAL ESTELA LANGE DE BERNAL
09H02351,ESCUELA DE EDUCACION BASICA FISCAL CIUDAD DE AZOGUES
09H02365,SAN FRANCISCO DE QUITO
09H02392,UNIDAD EDUCATIVA JOSE MIGUEL GARCIA MORENO
09H02410,JARDIN ESCUELA MIXTA PARTICULAR MONSEÑOR ROBERTO
09H02424,INSTITUTO SUIZO
09H02432,UNIDAD EDUCATIVA FISCAL FRANCISCO DE ORELLANA
09H02493,UNIDAD EDUCATIVA PARTICULAR PRESIDENTE CARLOS JULIO AROSEMENA TOLA
09H02503,GUILLERMO SOTO ZATIZABAL
09H02554,ALMT. THOMAS CHARLES WRIGHT MONTGOMERY
09H02574,COLEGIO FISCAL LEONIDAS ORTEGA MOREIRA
09H02586,UNIDAD EDUCATIVA FISCAL MONSEÑOR LEONIDAS PROAÑO
09H02615,UNIDAD EDUCATIVA FISCOMISIONAL EL PROFETA JEREMIAS
09H02630,ESCUELA PARTICULAR DRA. GUADALUPE LARRIVA GONZALEZ
09H02634,UNIDAD EDUCATIVA INTERNACIONAL SEK
09H02723,UNIDAD EDUCATIVA PARTICULAR VOLUNTAS DEI
09H02738,ESCUELA PARTICULAR MIXTA 830 REMINISCENCIAS
09H02746,UNIDAD EDUCATIVA PADRE SOMASCOS EL CENACULO
09H02759,CENTRO DE EDUCACION BASICA VICENTE PIEDRAHITA CARBO
09H02775,UNIDAD EDUCATIVA CARLOS JULIO AROSEMENA TOLA
09H02787,ESCUELA DE EDUCACION BASICA PARTICULAR OCEANO PACIFICO
09H02790,UNIDAD EDUCATIVA FISCAL LUIS FERNANDO VIVERO
09H02794,ESCUELA DE EDUCACION BASICA FISCAL PABLO NERUDA
09H02795,ESCUELA DE EDUCACION BASICA FISCAL ILEANA ESPINEL CEDEÑO
09H02804,ESCUELA DE EDUCACION BASICA FISCAL MANUEL MARIA SANCHEZ
09H02809,UNIDAD EDUCATIVA PARTICULAR LUIS CHIRIBOGA MANRIQUE
09H02842,ESCUELA DE EDUC. BASICA COMPLETA NO. 1 SARAGURO
09H02943,UNIDAD EDUCATIVA 26 DE SEPTIEMBRE
09H03062,CIUDAD DE BALZAR
09H03195,FELIX SARMIENTO NUÑEZ 7
09H03203,UNIDAD EDUCATIVA BILINGÜE TORREMAR
09H03210,COLEGIO PARTICULAR OLMEDO
09H03227,UNIDAD EDUCATIVA FRANCISCO DOLERA
09H03288,MANUEL ANTONIO CHAGUAY
09H03323,CINCO  DE MAYO
09H03363,ESCUELA DE EDUCACION BASICA MARIA EULALIA AVILES
09H03369,UNIDAD EDUCATIVA LAUREL
09H03432,4 DE OCTUBRE
09H03443,VICTORIA TORRES DE NEIRA NO 1
09H03489,COLEGIO DE BACHILLERATO PROVINCIA DE IMBABURA
09H03526,JUAN BOSCO
09H03578,CIUDAD DE FILADELFIA
09H03600,EEB. MAURICIO SIMMONDS
09H03609,ESCUELA DE EDUCACION BASICA BENIGNO RODAS MALDONADO
09H03639,MARIETA DE VEINTIMILLA
09H03655,SANTA MARIANITA
09H03727,EEB. LOS ANDES
09H03791,CENTRO DE EDUCACION BASICA 29 DE SEPTIEMBRE
09H03860,ESCUELA DE EDUCACION BASICA SEGUNDO AU-HING
09H03999,E.E.B. EDUARDO KINGMAN
09H04110,U.E. VICENTE ANDA AGUIRRE
09H04122,U. E. FRANCISCANA SAN ANTONIO
09H04161,E.E.B. HUELLAS DE CONOCIMIENTO
09H04223,U.E. SAN JOSE
09H04230,E.E.B. SIMON BOLIVAR
09H04238,ESCUELA DE EDUCACION BASICA FERROVIARIA
09H04242,E.E.B. MIGUEL ANDRADE MANRIQUE
09H04250,U.E. MARISCAL SUCRE
09H04266,E.E.B. JUDITH ACUÑA DE ROBLES
09H04278,U.E. GUILLERMO DURAN ARCENTALES
09H04326,ESCUELA DE EDUCACION BASICA 24 DE JULIO
09H04330,ESCUELA DE EDUCACION BASICA SIMON BOLIVAR
09H04337,ESCUELA DE EDUCACION BASICA ATAHUALPA
09H04350,ESCUELA DE EDUCACION BASICA NARANJAL
09H04422,CARLOS MATAMOROS JARA
09H04429,UNIDAD EDUCATIVA PUEBLOS UNIDOS
09H04604,UNIDAD EDUCATIVA DR EDUARDO GRANJA GARCES
09H04663,UNIDAD EDUCATIVA MONTE TABOR NAZARET
09H04665,UNIDAD EDUCATIVA FISCAL CUENCA DEL GUAYAS
09H04676,ESCUELA DE EDUCACION BASICA FISCAL 26 DE JUNIO
09H04724,ESCUELA DE EDUCACION BASICA FISCAL DIEZ DE AGOSTO
09H04750,JUAN BAUTISTA VILLAMAR
09H04850,UNIDAD EDUCATIVA RAFAEL SOTOMAYOR Y LUNA
09H04911,CENTRO ESCUELA EUGENIO ESPEJO
09H04924,ESCUELA DE EDUCACION BASICA LUCILA SANTOS DE AROSEMENA
09H04939,UNIDAD EDUCATIVA MONSEÑOR FRANCISCO XAVIER DE GARAICOA
09H05002,ESCUELA DE EDUCACION BASICA TERESA ALAVEDRA ITAMA
09H05033,UNIDAD EDUCATIVA ELOY ALFARO
09H05034,ESCUELA DE EDUCACION BASICA ERNESTO JOUVIN CISNEROS
09H05035,ESCUELA DE EDUCACION BASICA 7 DE AGOSTO
09H05044,SONRISITAS DEL SABER
09H05074,MARIA LUISA LUQUE DE SOTOMAYOR
09H05075,CIUDAD DE PLAYAS
09H05110,ESCUELA DE EDUCACION BASICA MARIA DE SAN JOSE
09H05115,UNIDAD EDUCATIVA ARSENIO LOPEZ
09H05120,ESCUELA DE EDUCACION BASICA ABDON CALDERON MUÑOZ
09H05139,SAN CARLOS
09H05232,ESCUELA DE EDUCACION BASICA FISCOMISIONAL FRANCISCO GARCIA JIMENEZ
09H05264,UNIDAD EDUCATIVA AMERICANO DE GUAYAQUIL
09H05268,UNIDAD EDUCATIVA SIR THOMAS MORE
09H05361,CENTRO DE EDUCACION INICIAL APRENDER JUGANDO
09H05365,UNIDAD EDUCATIVA PARTICULAR BILINGÜE LICEO PANAMERICANO
09H05366,UNIDAD EDUCATIVA MARISCAL SUCRE
09H05369,UNIDAD EDUCATIVA DELFOS
09H05418,ESCUELA DE EDUCACION BASICA PARTICULAR LUCIO SENECA
09H05514,GARCIA MORENO
09H05542,ESCUELA DE EDUCACION BASICA PARTICULAR ANCON
09H05560,ESCUELA DE EDUCACION BASICA  PARTICULAR CIUDAD DE SAMARIA
09H05583,E.E.B. ALBORADA
09H05647,UNIDAD EDUCATIVA FUTUROS NAVEGANTES
09H05664,SEMILLERO DE LA PATRIA
09H05712,ESCUELA DE EDUCACION BASICA FISCAL JULIO ESTRADA ICAZA
09H05713,UNIDAD EDUCATIVA FISCAL AMERICA
09H05714,ESCUELA DE EDUCACION BASICA FISCAL ARNULFO JARAMILLO SIERRA
09H05775,UNIDAD EDUCATIVA FAE NO 3 TAURA
09H05824,UNIDAD EDUCATIVA HARVEST
09H05942,UNIDAD EDUCATIVA BILINGÜE CENTRO EDUCATIVO LA MODERNA
09H05974,ESCUELA DE EDUCACION BASICA POLIBIO JARAMILLO SAA
09H05980,SOLER LUX DEI
09H05981,ESCUELA DE EDUCACION BASICA FISCAL DOLORES VEINTIMILLA DE GALINDO
09H06043,UNIDAD EDUCATIVA PARTICULAR LICEO LOS ANDES
09H06051,ESCUELA DE EDUCACION B. FISCAL ANTONIO FLORES JIJON
09H06130,UNIDAD EDUCATIVA SOFOS
09H06184,CENTRO DE EDUCACION GENERAL BASICA PARTICULAR CIUDAD DE NAZARETH
09H06185,CENTRO DE EDUCACION GENERAL BASICA APOSTOL SAN JUDAS TADEO
09H06217,CENTRO DE EDUCACION INICIAL LOS ANDES
09H06645,ESCUELA DE EDUCACIÓN BÁSICA FISCOMISIONAL PADRE JOSÉ ANTONIO GONZÁLEZ DE DURANA
09H06670,UNIDAD EDUCATIVA PARTICULAR SAN FRANCISCO DE ASÍS
09H06690,UNIDAD EDUCATIVA LOS DELFINES
09H06710,UNIDAD EDUCATIVA PARTICULAR HUGO ALEMÁN
09H06718,UNIDAD EDUCATIVA JOSÉ JOAQUÍN DE OLMEDO
10H00015,U.E. MADRE TERESA BACQ
10H00042,COLEGIO NUESTRA SEÑORA DE FATIMA
10H00071,UNIVERSITARIO UTN
10H00073,U.E. LA VICTORIA
10H00074,U.E. SAN PEDRO PASCUAL
10H00094,JUAN PABLO SEGUNDO
10H00097,U.E. ALFREDO ALBUJA GALINDO
10H00098,UNIDAD EDUCATIVA FISCOMISIONAL SALESIANA SANCHEZ Y CIFUENTES
10H00101,U.E. PARTICULAR ATAHUALPA
10H00104,UNIDAD EDUCATIVA LA SALLE
10H00118,UNIDAD EDUCATIVA TEODORO GOMEZ DE LA TORRE
10H00131,U.E. VICTOR MANUEL GUZMAN
10H00134,SAN FRANCISCO
10H00229,DANIEL REYES
10H00245,HERMANO MIGUEL
10H00247,SANTA LUISA DE MARILLAC
10H00273,UNIDAD EDUCATIVA CHALTURA
10H00274,UNIDAD EDUCATIVA SAN ROQUE
10H00336,ISLA SANTA ISABEL
10H00351,HERNANDO DE MAGALLANES
10H00369,UNIDAD EDUCATIVA CUELLAJE
10H00378,ELOY PROAÑO
10H00396,UNIDAD EDUCATIVA SANTA JUANA DE CHANTAL
10H00398,UNIDAD EDUCATIVA REPUBLICA DEL ECUADOR
10H00406,OTAVALO VALLE DEL AMANECER
10H00410,UNIDAD EDUCATIVA JACINTO COLLAHUAZO
10H00411,UNIDAD EDUCATIVA TEMPORAL OTAVALO
10H00432,UNIDAD EDUCATIVA MONSENOR ULPIANO PEREZ QUINONES
10H00468,FLORENCIO O LEARY
11H00011,UNIDAD EDUCATIVA FISCOMISIONAL LA INMACULADA
11H00015,UNIDAD EDUCATIVA FISCOMISIONAL SAN FRANCISCO DE ASIS
11H00016,UNIDAD EDUCATIVA LA PORCIUNCULA
11H00034,ESCUELA PARTICULAR VESPERTINA CONFESIONAL LA DOLOROSA
11H00043,UNIDAD EDUCATIVA PARTICULAR ANTONIO PEÑA CELI
11H00076,ESCUELA DE EDUCACION BASICA FISCOMISIONAL EDUVIGES PORTALET
11H00078,ESCUELA ALONSO DE MERCADILLO
11H00079,ESCUELA DE EDUCACION BASICA MATER DEI
11H00080,LAURO DAMERVAL AYORA 1
11H00104,U.E MUNICIPAL HEROES DEL CENEPA
11H00111,ESCUELA DE EDUCACIN BASICA MUNICIPAL PRADERA GHYGHKVFEDUCATIVA MUNICIPAL PRADERA
11H00134,COLEGIO DE BACHILLERATO 27 DE FEBRERO
11H00139,ESCUELA DE EDUCACION BASICA PARTICULAR SIMON BOLIVAR
11H00164,COLEGIO NACIONAL ADOLFO VALAREZO
11H00165,UNIDAD EDUCATIVA MANUEL IGNACIO MONTERO VALDIVIESO
11H00171,UNIDAD EDUCATIVA MUNICIPAL TIERRAS COLORADAS
11H00178,ESCUELA DE EDUCACION BASICA MUNICIPAL BORJA
11H00185,ESCUELA DE EDUCACION BASICA PARTICULAR SAN ANDRES
11H00194,UNIDAD EDUCATIVA MUNICIPAL CAPULI LOMA
11H00216,ESCUELA DE EDUCACION BASICA MUNICIPAL ECOLOGICA
11H00217,UNIDAD EDUCATIVA MUNICIPAL DR ANGEL FELICISIMO ROJAS
11H00222,UNIDAD EDUCATIVA MUNICIPAL MONSEÑOR JORGE GUILLERMO ARMIJOS
11H00277,COLEGIO DE BACHILLERATO (PARTICULAR) EUGENIO ESPEJO
11H00280,UNIDAD EDUCATIVA (FISCOMISIONAL) CALASANZ
11H00283,UNIDAD EDUCATIVA MARIETA DE VEINTIMILLA
11H00287,COLEGIO DE BACHILLERATO (FISCOMISIONAL) DANIEL ALVAREZ BURNEO
11H00310,COLEGIO DE BACHILLERATO (FISCOMISIONAL) SAN VICENTE FERRER
11H00322,UNIDAD EDUCATIVA FISCOMISIONAL CORAZON DE MARIA
11H00374,UNIDAD EDUCATIVA (FISCOMISIONAL) MANUEL JOSE RODRIGUEZ
11H00465,COLEGIO DE BACHILLERATO DR BALTAZAR AGUIRRE
11H00471,UNIDAD EDUCATIVA FISCOMISIONAL SANTA JUANA DE ARCO LA SALLE
11H00473,UNIDAD EDUCATIVA MARIA AUXILIADORA
11H00505,UNIDAD EDUCATIVA MONS SANTIAGO FERNANDEZ GARCIA
11H00585,EEB CARLOS MONTUFAR
11H00649,UNIDAD EDUCATIVA FISCOMISIONAL SAN JUAN BAUTISTA
11H00660,INSTITUTO TECNOLOGICO SUPERIOR NUESTRA SEÑORA DEL ROSARIO
11H00740,UNIDAD EDUCATIVA SANTA TERESITA
11H00759,COLEGIO DE BACHILLERATO TNTE MAXIMILIANO RODRIGUEZ
11H00811,UNIDAD EDUCATIVA LA DOLOROSA
11H00937,UNIDAD EDUCATIVA FISCOMISIONAL PADRE JORGE ABIATAR QUEVEDO FIGUEROA
11H01048,ESCUELA DE EDUCACION BASICA JOHN F. KENNEDY
11H01076,UNIDAD EDUCATIVA FISCOMISIONAL MARISTA
11H01160,UNIDAD EDUCATIVA FISCOMISIONAL DOMINGO CELI
11H01251,ESCUELA DE EDUCACION BASICA BERMEO VASQUEZ
11H01263,ESCUELA FISCOMISIONAL GRAN COLOMBIA
11H01357,COLEGIO DE BACHILLERATO MANUEL CARRION PINZANO
11H01381,COLEGIO DE BACHILLERATO CELINA VIVAR ESPINOSA
11H01384,UNIDAD EDUCATIVA FISCOMISIONAL FRAY CRISTOBAL ZAMBRANO
11H01465,COLEGIO DE BACHILLERATO VIRGILIO ABARCA MONTESINOS
11H01551,JOSE ANTONIO CAMPOS
11H01723,UNIDAD EDUCATIVA MONS. ALBERTO ZAMBRANO PALACIOS
11H01835,UNIDAD EDUCATIVA FISCOMISIONAL MONSENOR LUIS ALFONSO CRESPO CHIRIBOGA
11H01836,UNIDAD EDUCATIVA FISCOMISIONAL JULIO ERNESTO CELI
11H01963,COLEGIO DE BACHILLERATO PARTICULAR ANTONIO PEÑA CELI
12H00023,ESCUELA DE EDUCACION BASICA FRANCISCO ROBLES
12H00044,UNIDAD EDUCATIVA PARTICULAR MARCOS BENETAZZO
12H00074,UNIDAD EDUCATIVA ISABEL LA CATOLICA
12H00149,UNIDAD EDUCATIVA CARLOS ALBERTO AGUIRRE AVILES
12H00200,ROSA CHAVEZ SELLAN
12H00217,UNIDAD EDUCATIVA 29 DE AGOSTO
12H00255,CARITAS MAGICAS
12H00289,ESCUELA DE EDUCACION BASICA FAUSTO MISAEL OLALLA GAYBOR
12H00342,ESCUELA DE EDUCACION BASICA  ECUADOR
12H00468,UNIDAD EDUCATIVA 16 DE JULIO
12H00481,E.E.B GUARANDA
