amie,nombre_institucion
05H00597,Unidad Educativa Gral. Eloy Alfaro
05H00695,UEM Canchagua
05H00716,Unidad Educativa Sigchos
05H00778,Carlos Bayardo Limaico Bassante
05H00838,Jorge Washington
05H00839,General de Policía Bolívar Cisneros
05H00855,Colegio de Bachillerato Técnico Luis Fernando Ruiz
06B00020,Shiry Cacha
06B00050,Mushuk Pakari
06B00114,Unidad Educativa Intercultural Bilingüe Huanca Pallaguchi
06B00119,Charles Darwin
06B00137,Unidad Educativa Intercultural Bilingüe Totoras Indígenas
06B00140,Río Jubal
06B00216,Unidad Educativa Intercultural Bilingüe Ingeniero Hermel Tayupanda
06B00235,Unidad Educativa Intercultural Bilingüe General Rumiñahui
06B00389,Batalla de Tío Cajas
06B00404,Unidad Educativa Intercultural Bilingüe Achullay
06B00484,Educación General Básica Luis Cordero Crespo
06B00486,Rafael Avilés Moncayo
06B00498,Héroes del Cenepa Atapo Santa Cruz
06H00002,Unidad Educativa Jefferson
06H00020,Centro de Educación Básica 21 de Abril
06H00255,Unidad Educativa Adolfo Kolping
06H00759,Unidad Educativa Fiscal Galápagos
06H00772,Unidad Educativa 24 de Mayo
06H00854,Unidad Educativa Chunchi
06H00957,Dra. Francisca Paguay
06H01004,27 de Febrero
06H01032,Colegio Técnico Nacional Alfredo Pérez Guerrero
06H01064,Unidad Educativa Dr. Manuel Rodríguez Orozco
06H01081,República Federal de Alemania
06H01216,Dr. Gonzalo Oleas Zambrano
06H01261,Unidad Educativa del Milenio Penipe
06H01290,Manuel Álvarez Méndez
06H01325,Mariscal Sucre
07H00004,Sagrado Corazón de Jesús
07H00043,Colegio de Bachillerato República del Ecuador
07H00046,Unidad Educativa Particular Bilingüe El Principito & Marcel Laniado de Wind
07H00135,Víctor Antonio Moreno Mosquera
07H00268,Tía Patty
07H00275,Sulima García Valarezo
07H00397,Amazonas
07H00411,Colegio de Bachillerato Arenillas
07H00485,Colegio de Bachillerato Ayapamba
07H00741,Lcda. Olga Campoverde
07H00762,Colegio de Bachillerato Marcabeli
07H00827,Unidad Educativa Particular Santísimos Corazones
07H00976,Escuela de Educación Básica Juan Jacobo Rousseau
07H01025,Colegio de Bachillerato Miguel Ángel Corral
07H01088,Herminia Grunauer de Loayza
07H01107,CEP Unidad Educativa Particular Altamira
07H01197,Colegio de Bachillerato Miguel Sánchez Astudillo
07H01220,Escuela de Educación Básica 29 de Noviembre
07H01260,Colegio de Bachillerato 07 de Septiembre
07H01461,Unidad Educativa Particular del Pacífico
07H01493,Unidad Educativa del Milenio General Eloy Alfaro delgado
08B00014,Escuela EGB Fiscal German Nastacuaz
08B00025,Escuela EGB Fiscal Gonzalo Pizarro
08H00021,Colegio Anexo UniversitaRío José Basurto Mendoza
08H00024,Escuela EGB Fiscal Ricardo Paredes Romero
08H00075,Escuela EGB Nazareth
08H00147,Unidad Educativa 21 de Septiembre
08H00158,Unidad Educativa Fiscal Esmeraldas
08H00209,Escuela EGB Fiscal Ciudad de Riobamba
08H00292,Nuevo Mundo
08H00297,Colegio de Bachillerato Fiscal Libertad de Timbre
08H00308,Escuela EGB Fiscal Ricardo Paredes Romero
08H00345,Unidad Educativa Particular Frances
08H00414,Unidad Educativa Fiscomisional Paulo VI
08H00431,Col. Técnico 16 de Octubre
08H00440,Unidad Educativa Santa María de Los Cayapas
08H00513,Escuela EGB Fiscal Gran Colombia
08H00580,U.E. Alfredo Pérez Guerrero
08H00611,Escuela EGB República de Francia
08H00690,Colegio Bachillerato Fiscal Luz María Molina
08H00709,Centro Educativo de Enseñanza Artesanal 16 de Agosto
08H00750,Escuela EGB Ernesto Velásquez Kuffo
08H00756,Escuela EGB 3 de Julio
08H00770,Escuela EGB Puerto Balao
08H00796,Colegio de Bachillerato Particular Manuel Antonio Casanova Macías
08H00811,Colegio Andrés F. Córdova
08H00939,EGB Simón Bolívar
08H00976,EGB Malimpia
08H01039,Escuela Marieta de Veintimilla
08H01069,Carlos Garbay Montesdeoca
08H01112,Tierra Esmeraldeña
08H01164,Nueva Concordia
08H01183,Escuela EGB Mariscal Sucre
08H01200,Colegio de Bachillerato 22 de Marzo
08H01256,Escuela EGB Fiscal Juan Benigno Checa Drouet
08H01293,Escuela EGB Príncipe de Paz
08H01310,Escuela EGB Adalberto Ortiz Quiñónez
08H01433,Unidad Educativa Fiscal del Milenio Profesora Consuelo Benavides
08H01567,Manuela Cañizares
08H02246,Escuela de EGB Personitas del Futuro
08H02255,Jorge Chiriboga Guerrero
08H02258,Unidad Educativa del Milenio Simón Plata Torres
09B00038,Unidad Educativa Comunitaria Intercultural Bilingüe Cacique Tumbala
09H00093,Unidad Educativa Fiscal Rafael García Goyena
09H00281,Luz y Vida
09H00354,Capitán Pedro Oscar Salas Bajaña
09H00397,Escuela Nro. 151 Enrique Gil Gilbert
09H00457,Sir Francis Bacon
09H00473,Unidad Educativa Fiscal Pablo Hannibal Vela Egüez
09H00481,Abraham Lincoln
09H00495,Jardín y Escuela Geniecitos A Triunfar
09H00674,Colegio Particular Instituto Coello
09H00719,Unidad Educativa Aguirre Abad
09H00803,Unidad Educativa Particular José María Urbina
09H00813,Colegio Particular PERT
09H01301,Escuela de Educación Básica Particular Guayas y Quil
09H01327,Unidad Educativa Prócer León de Febres Cordero
09H01409,Escuela Santa Narcisa de Jesús
09H01501,Unidad Educativa Brisas del Río
09H01547,Gral. George Smith Patton
09H01581,Márquez de Selva Alegre
09H01619,General M Edelman
09H01802,Escuela de Educación Básica Fiscal María Barquet de Isaías
09H01866,Unidad Educativa Básica Ecomundo Vespertino
09H01926,Unidad Educativa Santa María Goretti
09H01939,Unidad Educativa Particular San Luis
09H02114,Colegio Fiscal Técnico Provincia de Chimborazo
09H02136,Las Cumbres 1370
09H02211,Vida Nueva
09H02408,Río Macará
09H02426,Sagrada Familia
09H02443,Escuela de Educación Básica Superior Fiscal Dra. Bertha Valverde de Duarte
09H02560,Unidad Educativa Lola Arosemena de Carbo
09H02568,Escuela de Educación Básica Particular Ausubel
09H02689,Unidad Educativa Particular San Gabriel de La Dolorosa
09H02812,Colegio Fiscal Puna
09H02826,Escuela de Educación Básica Fiscal Nicolás Augusto González
09H02830,Escuela de Educación Básica Completa Fiscal #13 Luz de América
09H02832,Colegio Fiscal Primero de Junio
09H02865,Escuela de Educación Básica Primero de Junio
09H02867,Unidad Educativa Presidente Vicente Ramón Roca
09H02892,Escuela de Educación Básica Doce de Octubre
09H02898,Unidad Educativa Balao
09H02976,Nueva Juventud
09H03077,Mundo de Alegría
09H03078,Unidad Educativa Nuestra Señora del Rosario
09H03080,Doce de Septiembre
09H03138,Diez de Agosto
09H03159,Marieta Escobar Gavilánez
09H03168,Honoria Méndez Zambrano
09H03215,Unidad Educativa Presidente José Luis Tamayo
09H03248,Unidad Educativa Daulis
09H03371,Padre Juan de Velasco
09H03396,Patria Ecuatoriana
09H03411,Colegio Particular Nuestra Señora del Carmen
09H03492,Golfo de Guayaquil
09H03496,Escuela de Educación Básica Rina Ortiz de Bucaram
09H03590,Escuela de Educación Básica Carlos Julio Pérez Perasso
09H03592,Mons. Enrique Julhes
09H03641,Unidad Educativa Ciudad de Ariel
09H03779,Escuela de Educación Básica 23 de Noviembre
09H03793,Escuela Isabel María Luque de Ponce N.° 10
09H03803,Unidad Educativa El Empalme
09H03822,Unidad Educativa Coronel Pedro Vélez Morán
09H03850,Unidad Educativa Sagrado Corazón de Jesús
09H03877,Escuela de Educación Básica Divina Providencia
09H03972,Escuela de Educación Básica Daule Peripa
09H04030,Escuela de Educación Básica Antonio Neumane
09H04040,Unidad Educativa Vicente Rocafuerte
09H04058,Unidad Educativa El Triunfo
09H04060,Escuela de Educación Básica Juan Montalvo
09H04065,Escuela de Educación Básica República de Colombia
09H04066,Unidad Educativa Ciudad de Belén
09H04092,E.E.B. Victoria Macías de Acuña
09H04118,E.E.B Antonio José de Sucre
09H04127,Unidad Educativa Francisco Falquez Ampuero
09H04204,U.E. Paul Ponce Rivadeneira
09H04281,Carmen Mora de Encalada
09H04288,Mercedes Goetta de Parodi
09H04312,Colegio Fiscal Naranjal
09H04324,Mariscal Sucre
09H04395,Ismael Pérez Pazmiño
09H04408,Baltazara Calderón de Rocafuerte
09H04542,Centro de Educación Básica Fiscal N.º 2 Crespín Cerezo
09H04559,Escuela Heriberto Policarpo Rodríguez Ortega
09H04638,Unidad Educativa Particular Olida Dueñas Moreira
09H04722,Escuela de Educación Básica Fiscal Francisco de Orellana
09H04742,3 de Febrero
09H04790,Escuela de Educación Básica Trece de Mayo
09H04812,Unidad Educativa Cabuyal
09H04825,Escuela de Educación General Básica No. 3 Cmdt. Rafael Morán Valverde
09H04847,Colegio de Bachillerato General Vernaza
09H04858,Unidad Educativa Particular Franciscano Salitre
09H04899,Escuela de Educación Básica José Julián Sánchez
09H04981,Escuela de Educación Básica Abelardo García Arrieta
09H05004,Escuela de Educación Básica José María Egas
09H05047,Escuela de Educación Básica Mateo Díaz Fuentes
09H05048,Centro Escuela Vicente Rocafuerte
09H05056,Unidad Educativa Freirestabile
09H05067,Playas de Villamil
09H05085,Hacia La Cumbre
09H05088,Laura Vicuña
09H05096,Olga Aguilar Ramos
09H05151,Unidad Educativa Vicente Piedrahita Carbo
09H05206,Escuela de Educación Básica Mariscal Sucre
09H05223,Escuela Particular Santa Rosa
09H05247,Unidad Educativa de La Asunción
09H05315,Escuela de Educación Básica Particular Cordillera de Chongon
09H05394,Escuela Puerto de La Cruz
09H05452,Escuela de Educación Básica 27 de Diciembre
09H05471,Unidad Educativa Hogar de Jesús Nro. 3
09H05500,Unidad Educativa del Milenio Dr. Alfredo Raúl Vera Vera
09H05572,Escuela Los Lojas
09H05812,Escuela de Ed. Básica Particular Fedeguayas
09H05945,Young Living Academy
09H06024,Campoverde
09H06044,Unidad Educativa Ciudad de Belén
09H06054,Unidad Educativa Fiscal Replica Vicente Rocafuerte
09H06161,Tía Angie
09H06163,Unidad Educativa Fiscal Replica Guayaquil
09H06171,Unidad Educativa Fiscal Replica 28 de Mayo
09H06172,Unidad Educativa Fiscal Replica Técnico Simón Bolívar
09H06173,Unidad Educativa Fiscal Replica Aguirre Abad
10B00006,Manuel Freile Larrea
10B00031,Nazacota Puento
10B00032,San Jacinto
10B00043,Provincia de El Oro
10B00101,Tomás Rivadeneira
10B00130,Unidad Educativa Alejandro Chávez
10H00002,Sudamericano
10H00029,U.E. Yahuarcocha
10H00083,28 de Abril
10H00085,U.E. Diocesana Bilingüe
10H00099,U.E. Temporal Mariano Suárez Veintimilla
10H00155,Colegio Los Álamos
10H00158,Luis Napoleón Dillon
10H00201,U.E. Rumipamba
10H00224,Unidad Educativa Fiscomisional Inocencio Jácome
10H00249,Unidad Educativa Abelardo Moncayo
10H00261,Unidad Educativa Temporal Alberto Enríquez
10H00288,Instituto Tecnológico Superior Cotacachi
10H00311,Unidad Educativa Gabriel García Moreno
10H00352,Abelardo Morán Muñoz
10H00400,Diez de Agosto
10H00433,Jatun Kuraka Otavalo
10H00621,Unidad Educativa del Milenio Sumak Yachana Wasi
11B00034,CECIB de Educación Básica Lago de San Pablo
11B00041,Unidad Educativa Intercultural Bilingüe ABC
11H00014,Unidad Educativa (Particular) José Antonio Eguiguren-La Salle
11H00083,Escuela de Educación Básica Particular San Francisco Javier
11H00143,Escuela de Educación Básica Particular Siglo XXI
11H00344,Libertador Bolívar
11H00498,Escuela de Educación Básica Luz de América
11H00500,Unidad Educativa Cariamanga
11H00720,Escuela de Educación Básica República de Guatemala
11H00739,Escuela de Educación Básica Célica
11H00831,Colegio de Bachillerato Matilde Hidalgo de Procel
11H00851,Unidad Educativa Tiopamba
11H00861,Colegio de Bachillerato Rosa Herlinda García de García
11H00889,Colegio de Bachillerato Dr. Hugo Guillermo González
11H00899,Escuela de Educación Básica Riobamba
11H00900,Colegio de Bachillerato Ecuador
11H00963,Indoamericana
11H01052,Unidad Educativa del Milenio 5 de Junio
11H01060,Escuela de Educación Básica Diez de Agosto
11H01149,Escuela de Educación Básica Mons. Francisco Valdivieso
11H01150,Unidad Educativa Paltas
11H01244,Colegio de Bachillerato Macandamine
11H01317,Colegio de Bachillerato Ramón Samaniego Palacios
11H01476,Escuela de Educación Básica Juanita Collahuazo Páez
11H01542,Colegio de Bachillerato Zapotillo
11H01545,José Félix de Valdivieso
11H01560,Unidad Educativa Brasil
11H01607,Colegio de Bachillerato Galo Rolando Vélez Rivera
11H01666,Colegio de Bachillerato Ramón RiofRío Bustamante
11H01710,Reverendo Dr. Segundo Ignacio Godoy
12H00033,Escuela de Educación Básica Santa Mariana de Jesús
12H00061,Unidad Educativa María Andrea
12H00091,Escuela de Educación Básica Cristóbal Colón
12H00119,Unidad Educativa Rey David
12H00173,Escuela de Educación Básica Sofia Alarcón de Espín
12H00370,Escuela Educación Básica Benjamín Rosales Aspiazu
12H00375,Escuela de Educación Básica Guatemala
12H00409,Unidad Educativa Juan Montalvo
12H00461,Escuela de Educación Básica Pedro Pablo Gómez
12H00539,Unidad Educativa Aguirre Abad
12H00559,Escuela de Educación Básica Blanca Villamarin Ortiz
12H00617,E.E.B Miguel Suárez Seminario
12H00638,Unidad Educativa Aurora Estrada y Ayala
12H00712,Escuela de Educación Básica Héroes de Paquisha
12H01064,Unidad Educativa La Industria
12H01082,Unidad Educativa Ana Rosa Valdiviezo de Landívar
12H01094,Escuela de Educación Básica 13 de Abril
12H01100,Escuela de Educación Básica Real Audiencia de Quito
12H01144,Escuela de Educación Básica Adolfo Jurado
12H01204,Escuela de Educación Básica General Vicente Anda Aguirre
12H01219,Unidad Educativa Simón Rodríguez
12H01229,Escuela de Educación Básica Ricardo Astudillo Cárdenas
12H01230,Escuela de Educación Básica Pichincha
12H01235,Escuela Educación Básica Cenepa
12H01262,Escuela de Educación Básica Lucila Godoy
12H01289,Unidad Educativa Vinces
12H01307,Unidad Educativa Dr. Antonio Andrade Fajardo
12H01335,Escuela de Educación Básica Cristóbal Colón
12H01347,Escuela de Educación Básica Antonio Neumane
12H01422,Escuela de Educación Básica Luis Palacios Orellana
12H01485,Cinco de Junio
12H01544,Unidad Educativa Padre Manuel Sesma
12H01583,Unidad Educativa Rosa María Álava Moreira
12H01617,Escuela de Educación Básica Braulio Gabriel Rivera Muñoz
12H01733,Unidad Educativa Gladys Cedeño de Olivo
12H01806,Unidad Educativa Ercilia de Martínez
12H01847,Escuela de Educación Básica 1 de Julio
12H01897,Escuela de Educación Básica Mocache
12H01902,Unidad Educativa Libertador
12H02516,Replica Nicolás Infante Díaz
12H02518,Unidad Educativa Réplica Eugenio Espejo
13H00202,Escuela de Educación General Básica América
13H00310,Jean Piaget
13H00406,María Auxiliadora
13H00419,Unidad Educativa Jacinto Burgos Pinargote
13H00470,Horacio Hidrovo Velásquez
13H00522,Otto Arosemena Gómez
13H00644,Unidad Educativa Particular Sagrada Familia
13H00660,Escuela de Educación Básica Fiscal Vicente Mendoza Rivadeneira
13H00726,Escuela de Educación Básica Fiscal Dr. Isidoro Lara Zevallos
13H00774,Hualcopo Duchicela
13H00797,Unidad Educativa Particular Pablo VI
13H00807,María Angélica Hidrovo
13H00848,Luis Antonio Montesdeoca
13H00903,María Montessori
13H00923,U. E. Julia González Barberán
13H00970,Unidad Educativa San Cayetano de Chone
13H01063,Manuel Acosta Mero
13H01070,Unidad Educativa Plutarco Arteaga
13H01096,Unidad Educativa Camilo delgado Balda
13H01312,Francisco Zambrano Loor
13H01379,Aníbal Andrade Solorzano
13H01413,26 de Septiembre
13H01427,Elías Cedeño Jerves
13H01450,Unidad Educativa Jesucristo Rey
13H01671,Simón Bolívar
13H01679,Dr. Jacinto González
13H01704,7 de Agosto
13H01732,28 de Agosto
13H01758,El descanso de Los Romeros
13H01766,Escuela de Educación Básica Luzmila Arteaga Andrade
13H01767,José Jeremías Vera Loor
13H01841,Manuel Inocencio Parrales y Guales
13H01922,República del Ecuador
13H01951,Daniel López
13H01988,Escuela de Educación Básica Luis Augusto Mendoza Moreira
13H02046,Escuela de Educación Básica Leopoldo N Chávez
13H02136,Juan Antonio Vergara Alcívar
13H02164,Unidad Educativa Bahía de Manta
13H02196,Jehová es mi Pastor
13H02532,U.E.P. María Montessori
13H02596,Escuela Particular Simón Bolívar
13H02635,Estrella de Belén
13H02637,Escuela Educación Básica 26 de Junio
13H02662,Unidad Educativa Fiscal Santa Marianita
13H02698,Escuela Educación Básica José María Urbina
13H02737,Juan León Mera
13H02784,José Aníbal Carrillo Mero
13H02817,Unidad Educativa Paján
13H02818,Unidad Educativa Cascol
13H02974,Escuela de Educación Básica Fiscal 12 de Octubre
13H03003,Unidad Educativa Pichincha
13H03016,Benjamín Carrión
13H03021,Vicente Rocafuerte
13H03070,Nuevo Amanecer
13H03110,Jaime Roldós Aguilera
13H03115,2 de Agosto
13H03195,Albertina Rivas Medina
13H03231,Quito
13H03263,Silvestre Barreto
13H03392,Escuela de Educación Basic Pueblo Nuevo
13H03401,Unidad Educativa Interamericano
13H03403,Unidad Educativa Fiscal Leónidas Plaza
13H03513,San Isidro
13H03603,María Luisa Aldaz Romo
13H03636,Carlos Julio Arosemena Tola
13H03802,José Joaquín de Olmedo
13H03836,U.E. Ciudad de Pedernales
13H03844,República del Ecuador
13H03887,Ciudad de Pedernales
13H03892,Unidad Educativa Técnico AgropecuaRío Pedernales
13H03974,Ruta del Sol
13H03976,Condor Mirador
13H03978,Oswaldo Gracia Márquez
13H03985,Víctor Manuel Peñaherrera
13H04002,Pedro Vicente Maldonado
13H04035,Simón Bolívar
13H04062,Unidad Educativa Fiscal Río Puca
13H04125,Coronela Filomena Chávez Mora
13H04180,Unidad Educativa Fiscal 2 de Agosto
13H04222,24 de Mayo
13H04306,Alianza Para El Progreso
13H04361,Gabriela Mistral
13H04420,12 de Octubre
13H04537,Unidad Educativa del Milenio Replica Manta
13H04544,Esteban Medardo Acosta
13H04554,31 de Marzo
13H04561,Ciudad de Jipijapa
13H04587,Bejucal
13H04611,Patria Ecuatoriana
13H04666,8 de Septiembre
13H04783,Colegio Fiscal Tabuga
13H05165,Unidad Educativa del Milenio Dr. Carlos Romo Dávila
13H05177,Marie y Pierre Curie
13H05178,Efraín Sánchez
13H05181,U.E.M. Pedro Agustín López Ramos
13H05196,José Ignacio Mendoza
14B00028,Unidad Educativa Fiscomisional Domingo Savio
14B00036,CECIB de Educación Básica Fiscomisional Juan León Mera
14B00042,Etsa
14B00051,Alfredo Pérez Guerrero
14B00071,Nunkui
14B00139,Jacinto Collahuazo
14B00156,Nunkui
14B00171,Tunta
14B00178,Juana Oliva Rivera
14B00214,Arutam
14B00244,Santiak
14B00269,Colegio de Bachillerato Fisco-Misional Achuar
14B00301,Ecuador Amazónico
14B00362,Kanus
14B00371,Unidad Educativa Experimental Yamaram Tsawaa Extensión Yaupi
14B00389,Unidad Educativa General Plaza
14B00397,Sunka
14B00398,Jaime Roldós Aguilera
14B00421,Doce de Octubre
14B00471,CECIB de Educación Básica Fiscomisional Nankamaku PCEI
14H00072,Ángel Héctor Galeas Rivadeneira
14H00113,Teresa Samaniego Ávila
14H00119,Escuela de Educación Básica Fiscomisional Pedro de Vergara
14H00160,Unidad Educativa José María Velasco Ibarra
14H00169,Unidad Educativa Nueva Tarqui
14H00191,Escuela de Educación Básica Fiscomisional Simón Bolívar
14H00282,Presidente Cordero
14H00320,Escuela de Educación Básica Fiscomisional San Francisco
14H00375,Manuela Cañizares
14H00377,Unidad Educativa Huamboya
14H00421,Unidad Educativa Taisha
14H00454,1 de Marzo
14H00716,Unidad Educativa del Milenio Bosco Wisuma
15B00040,Unidad Educativa Comunitaria Intercultural Bilingüe David Miller
15B00048,Manuela Cañizares
15B00085,Unidad Educativa Comunitaria Intercultural Bilingüe Jacinto Collahuazo
15B00114,Yawari
15B00123,Puma Urcu
15B00129,Unidad Educativa Comunitaria Intercultural Bilingüe Gonzalo David Avilez Tanguila
15B00201,Cepib Antioquia
15B00204,Unidad Educativa del Milenio San José de Chonta Punta
15H00011,2 de Octubre
15H00033,Aldelmo Rodríguez
15H00034,Unidad Educativa Nacional Tena
15H00073,Unidad Educativa Técnica Experimental del Milenio Ahuano
15H00119,Unidad Educativa Guillermo Kadle
15H00157,Unidad Educativa Archidona
15H00194,Tarqui
15H00208,Unidad Educativa El Chaco
15H00226,Baeza
15H00228,Manuel Villavicencio
15H00230,General Quis Quis
15H00300,Juan León Mera
15H00372,Unidad Educativa Milenio Santa Rosa
16B00044,Río Bobonaza
16B00075,Unidad Educativa Intercultural Bilingüe Pakayaku
16B00088,Unidad Educativa Intercultural Bilingüe Tsantsa
16B00096,Jorge Guzmán Rueda
16B00150,Unidad Educativa Gabriel López
16B00168,Unidad Educativa Gaita Weno
16B00231,Carlos Luis Plaza Aray
16H00007,Federación deportiva de Pastaza
16H00011,Mons. Tomás Romero Gross
16H00031,Unidad Educativa Francisco de Orellana
16H00045,Esperanza Eterna
16H00059,Escuela Fiscal Mixta República Argentina
16H00123,Tarqui
16H00155,Amazonas
17B00040,Tránsito Amaguaña
17B00136,Juan Vicente Morales
17B00213,Unidad Educativa Comunitaria Intercultural Bilingüe 29 de Octubre
17H00077,Juan Pablo II del Condado
17H00107,Jumandi
17H00213,New Visión School
17H00228,Helen Keller
17H00268,Unidad Educativa Particular John Neper
17H00379,Arturo Borja
17H00428,Proyecto J
17H00432,Aristóteles
17H00438,Unidad Educativa Fiscal del Milenio Replica Mejía
17H00441,Unidad Educativa Fiscal del Milenio Replica 24 de Mayo
17H00610,Coronel Oswaldo Vaca Lara
17H00625,Policía Nacional
17H00669,Nuestra Madre de La Merced
17H00826,Rafael Larrea Andrade
17H00882,Unidad Educativa Particular Francisca de Las Llagas
17H00963,El Trébol
17H00968,Frau Klier
17H01013,Liceo Internacional
17H01063,Británico Internacional
17H01084,Juan Francisco Leoro Vásquez
17H01210,Delia Ibarra de Velasco
17H01230,San Antonio María Claret
17H01318,Pablo Muñoz Vega
17H01351,Los Pinos
17H01361,Panamericano 2
17H01376,Solidaridad
17H01463,Cardenal Spinola de Fe y Alegría
17H01490,2878Jacinto Jijón y Caamaño
17H01511,Prócer Antonio Aguirre
17H01569,Presidente George Washington
17H01602,Nuevo Ecuador
17H01627,Jaime Luciano Balmes
17H01742,Fray Jodoco Ricke
17H01748,Johannes Kepler
17H01750,Unidad Educativa Particular Terranova
17H01789,General Rumiñahui
17H01790,Alfredo Pérez Chiriboga
17H01820,Pedro José Arteta
17H01821,Afraser Fe y Alegría
17H01921,Bautista Charles Spurgeon
17H02148,Fernando Ortiz Crespo
17H02157,Rousseau
17H02160,Técnico Cayambe
17H02163,Nasacota Puento
17H02196,Mariana de Jesús
17H02252,José Mejía Lequerica
17H02271,Vicente Miranda
17H02275,Aloag
17H02278,Elia Liut
17H02440,Marqués de Selva Alegre
17H02443,Adventista Gedeón
17H02467,Jahibe
17H02508,Feliciano Checa
17H02568,Vicente Anda Aguirre
17H02638,Escuela de Educación Básica 8 de septiembre
17H02646,Unidad Educativa Puerto Quito
17H02681,Campo Verde
17H03054,Saint Patrick
17H03085,Educación Multilingüe y desarrollo del Individuo
17H03168,William Henry Perkin
17H03190,Unidad Educativa Particular Cervantes
17H03319,Santa Mariana de Jesús
17H03321,Luis de La Torre
17H03625,Unidad Educativa del Milenio Lic. Rafael Fiallos Guevara
17H03659,Unidad Educativa del Milenio Ernesto Noboa y Caamaño
18B00011,Unidad Educativa del Milenio Intercultural Bilingüe Chibuleo
18B00024,Unidad Educativa Intercultural Bilingüe Tamboloma
18B00035,U.E. del Milenio Pueblo Kisapincha
18B00064,Unidad Educativa Huayna Capac
18H00002,Génesis
18H00014,Glenn Doman
18H00065,Liceo Cristiano Emanuel
18H00140,Centro Escolar Ecuador
18H00147,Luis Felipe Borja
18H00155,Une de Tungurahua
18H00160,Unidad Educativa Adventista Ambato
18H00161,La Granja Ceblag
18H00208,Héroes del 95
18H00283,Quisapincha
18H00331,Baños
18H00338,Doctor Misael Acosta Solís
18H00367,Pedro Fermín Cevallos
18H00402,Eduardo Samaniego
18H00469,Josefa Calixto
18H00560,Los Andes
18H00597,Hualcopo Duchicela
18H00621,Pichincha
19B00029,Centro Educativo Comunitario Intercultural Bilingüe de Educación Básica Ángel Nolberto Suárez
19B00047,Ciudad de Ambato
19B00084,Juan Chuinda
19H00056,Unidad Educativa Daniel Martínez Ordoñez
19H00060,Escuela de Educación Básica Medardo Ángel Silva
19H00119,Unidad Educativa Manuela Sáenz
19H00158,Colegio de Bachillerato Zumba
19H00174,Brasil
19H00227,Manuel Caiza Untuña
19H00263,Escuela de Educación Básica General Rumiñahui
19H00353,Abelardo Moncayo
19H00384,Unidad Educativa Zumbi
19H00399,Fray Carlos Uria
19H00490,Colegio de Bachillerato Soberanía Nacional
19H00586,Unidad Educativa del Milenio 10 de Noviembre
20H00006,Escuela de Educación Básica Alejandro Alvear
20H00008,Colegio Técnico Fiscal Ignacio Hernández
20H00026,Miguel Ángel Cazares
20H00033,Unidad Educativa Particular Tomás de Berlanga
21B00007,Hatun Sacha Alfredo Pareja Diezcanseco
21B00027,Rumipamba
21B00073,Unidad Educativa Intercultural Bilingüe Oriente Ecuatoriano
21B00092,Río Tomebamba
21B00103,General Mires
21B00107,Unidad Educativa Luis Felipe Wajarei
21B00109,Lorenzo de Garaicoa
21B00134,Mushuk Kawsay
21B00173,Víctor Dávalos
21B00180,Ciudad de Salinas
21H00095,26 de Mayo
21H00120,20 de Junio
21H00128,Lago Agrio
21H00132,Consejo Provincial de Napo
21H00136,Simón Bolívar
21H00223,Vasco Núñez de Balboa
21H00226,UEM Rafael Rodríguez Palacios (Rafael Rodríguez Palacios)
21H00383,Lumbaqui
21H00399,Puerto Libre
21H00404,Unión y Progreso
21H00405,San Miguel
21H00521,Unidad Educativa San Juan Bautista de La Salle
21H00578,Unidad Educativa del Milenio Pedro Vicente Maldonado
21H00664,La Barquilla
21H00679,Cascales
21H00699,Rafael Díaz Icaza
21H00724,Humberto Fierro
21H00751,Cuyabeno
22B00016,Ñukanchi Wasi
22B00054,Unidad Educativa Comunitaria Intercultural Bilingüe 12 de Septiembre
22B00081,Río Tiputini
22B00083,San Francisco de Asís
22B00086,Teniente Rodríguez Loaiza
22B00102,San Antonio
22B00121,UEM Huiruno (Jaime Roldós Aguilera)
22H00043,Cabo Wilson Cueva Pillajo
22H00145,Ciudad de Coca
22H00147,Víctor Sergio Ron Vega
22H00171,Eugenio Espejo
22H00174,Gustavo Lara
22H00185,Flor del Oriente
22H00226,La Esperanza
22H00261,Río Chingual
22H00325,Lago San Pedro
22H00331,Mercedes de Jesús Molina
22H00461,Jaime Roldós Aguilera
22H00531,Unidad Educativa del Milenio Nuevo Rocafuerte
22H00560,Unidad Educativa del Milenio Dayuma Kento
23B00003,Puruhá
23H00058,Cavanis
23H00085,Unidad Educativa Villa Florida
23H00156,Unidad Educativa Mi Inun Ya
23H00185,Menor Uniandes
23H00293,Central
23H00313,Pierre Hitti
23H00388,Prócer Manuel Quiroga
23H00457,Unidad Educativa Hernán Malo González
23H00488,Ciudad de México
23H00533,Escuela de Educación Básica Ciudad de Loja
23H00564,Lorgio Córdova Santander
23H00601,San Pedro de Valle Hermoso
23H00646,La Sagrada Familia
